{
  "$schema": "https://json-schema.org/draft/2020-12/schema",
  "$id": "https://opensimlab.com/catalog/scenario-completion.schema.json",
  "title": "Open Sim Lab scenario completion audit",
  "type": "object",
  "additionalProperties": false,
  "required": [
    "schemaVersion",
    "moduleId",
    "capabilityVersion",
    "scenarioCount",
    "completeScenarioCount",
    "scenarios"
  ],
  "properties": {
    "schemaVersion": {
      "const": 1
    },
    "moduleId": {
      "type": "string",
      "minLength": 1
    },
    "capabilityVersion": {
      "type": "string",
      "minLength": 1
    },
    "scenarioCount": {
      "type": "integer",
      "minimum": 0
    },
    "completeScenarioCount": {
      "type": "integer",
      "minimum": 0
    },
    "scenarios": {
      "type": "array",
      "items": {
        "type": "object",
        "additionalProperties": false,
        "required": [
          "scenarioId",
          "title",
          "moduleId",
          "environment",
          "estimatedMinutes",
          "difficulty",
          "prerequisites",
          "practiceRegions",
          "fidelityClass",
          "contentVersion",
          "capabilityVersion",
          "maturity",
          "complete",
          "requirements"
        ],
        "properties": {
          "scenarioId": {
            "type": "string",
            "pattern": "^[a-z0-9-]+$"
          },
          "title": {
            "type": "string",
            "minLength": 3
          },
          "moduleId": {
            "type": "string",
            "minLength": 1
          },
          "environment": {
            "enum": [
              "operating-room",
              "emergency-department",
              "icu",
              "ward",
              "delivery-room",
              "neonatal-unit",
              "clinic",
              "prehospital"
            ]
          },
          "estimatedMinutes": {
            "type": "number",
            "minimum": 1
          },
          "difficulty": {
            "enum": [
              "introductory",
              "intermediate",
              "advanced"
            ]
          },
          "prerequisites": {
            "type": "array",
            "items": {
              "type": "string"
            }
          },
          "practiceRegions": {
            "type": "array",
            "minItems": 1,
            "items": {
              "type": "string"
            }
          },
          "fidelityClass": {
            "enum": [
              "closed_loop_physiology",
              "state_transition",
              "branching_encounter"
            ]
          },
          "contentVersion": {
            "type": "string",
            "pattern": "^\\d+\\.\\d+\\.\\d+$"
          },
          "capabilityVersion": {
            "type": "string",
            "minLength": 1
          },
          "maturity": {
            "enum": [
              "draft",
              "preview",
              "source_checked",
              "clinically_reviewed",
              "institution_endorsed",
              "withdrawn"
            ]
          },
          "complete": {
            "type": "boolean"
          },
          "requirements": {
            "type": "array",
            "minItems": 15,
            "maxItems": 15,
            "items": {
              "type": "object",
              "additionalProperties": false,
              "required": [
                "id",
                "status",
                "evidence"
              ],
              "properties": {
                "id": {
                  "enum": [
                    "identity-and-versions",
                    "bounded-fictional-patient",
                    "observable-objectives",
                    "deterministic-seed-policy",
                    "meaningful-progression",
                    "meaningful-actions-and-choices",
                    "shared-capability-consequences",
                    "bounded-stop-condition",
                    "guidance-and-demonstration",
                    "debrief-and-counterfactual",
                    "source-provenance",
                    "scenario-specific-limitations",
                    "reference-transcripts",
                    "inclusive-runtime-verification",
                    "report-control-coverage"
                  ]
                },
                "status": {
                  "enum": [
                    "satisfied",
                    "missing"
                  ]
                },
                "evidence": {
                  "type": "array",
                  "minItems": 1,
                  "items": {
                    "type": "string",
                    "minLength": 1
                  }
                }
              }
            }
          }
        }
      }
    }
  }
}
