{
  "schemaVersion": 1,
  "moduleId": "infectious-disease",
  "capabilityVersion": "0.1.0-alpha.48",
  "scenarioCount": 10,
  "completeScenarioCount": 0,
  "scenarios": [
    {
      "scenarioId": "meningococcal-sepsis-recognition-and-escalation",
      "title": "Meningococcal sepsis with a non-blanching rash",
      "moduleId": "infectious-disease",
      "environment": "emergency-department",
      "estimatedMinutes": 7,
      "difficulty": "advanced",
      "prerequisites": [],
      "practiceRegions": [
        "US",
        "GB"
      ],
      "fidelityClass": "state_transition",
      "contentVersion": "0.1.0",
      "capabilityVersion": "0.1.0-alpha.48",
      "maturity": "preview",
      "complete": false,
      "requirements": [
        {
          "id": "identity-and-versions",
          "status": "satisfied",
          "evidence": [
            "Scenario meningococcal-sepsis-recognition-and-escalation carries stable content version 0.1.0.",
            "Capability version 0.1.0-alpha.48 is bound by this audit."
          ]
        },
        {
          "id": "bounded-fictional-patient",
          "status": "satisfied",
          "evidence": [
            "The declarative scenario schema validates a bounded fictional patient profile."
          ]
        },
        {
          "id": "observable-objectives",
          "status": "satisfied",
          "evidence": [
            "6 objectives map to debrief rubric evidence."
          ]
        },
        {
          "id": "deterministic-seed-policy",
          "status": "satisfied",
          "evidence": [
            "meningococcal-sepsis-fixtures.ts binds seed 5101 and content 0.1.0 to expert, incomplete-care, recovery, and no-action contrasts. No stochastic infection or host-response model is claimed."
          ]
        },
        {
          "id": "meaningful-progression",
          "status": "satisfied",
          "evidence": [
            "meningococcal-sepsis.ts separates an untreated ten-minute deterioration from the one-hour review after recorded intent. The two states are distinct: the untreated contrast worsens perfusion and conscious level, while the reviewed state shows an inadequate response with a risen C-reactive protein that is deliberately not treatment failure. Unrequested laboratory and perfusion findings remain private."
          ]
        },
        {
          "id": "meaningful-actions-and-choices",
          "status": "satisfied",
          "evidence": [
            "Dose-free choices independently record rash recognition, senior telephone ownership, sampling, bounded antimicrobial intent, bounded fluid and critical-care intent, boundary review, and surveillance. Consultant attendance in person is a distinct escalation from telephone ownership. Excluding sepsis on markers, excluding meningococcal disease on MenACWY vaccination, and delaying transfer for antimicrobials are refused."
          ]
        },
        {
          "id": "shared-capability-consequences",
          "status": "satisfied",
          "evidence": [
            "The scenario executes through the shared deterministic anesthesia engine rather than a display-only script."
          ]
        },
        {
          "id": "bounded-stop-condition",
          "status": "satisfied",
          "evidence": [
            "Rash recognition, senior ownership, sampling, both bounded intents, boundary review, surveillance, and a current full assessment permit unresolved-shock handoff. Consultant attendance is gated only once the authored one-hour review has fired. Instructor takeover bounds a run with no intent or senior ownership at 30 minutes, or an unfinished session at 180 minutes."
          ]
        },
        {
          "id": "guidance-and-demonstration",
          "status": "satisfied",
          "evidence": [
            "Eleven observed-state prompts at version 0.1.0 read the learner's own recorded steps. Unassisted is silent and coached withholds the two waiting beats. Worked example 0.1.0 drives the ordinary controls through the real engine to handoff. Both refuse the two exclusions this lesson offers — an unimpressive marker set and a vaccination that does not cover the serogroup — without ever asserting the diagnosis, because recognizing a pattern is not confirming one and nothing here confirms anything. Neither selects an agent, dose, route, dilution, or infusion; what is recorded is intent. The example waits for the authored one-hour review to show an inadequate response before escalating for attendance rather than performing that escalation because a demonstration ought to contain it, and a test asserts the reassessment precedes it. tests/unit/meningococcal-sepsis-demonstration.test.ts and tests/ui/meningococcal-sepsis-tray.test.tsx verify observed response, silence when unassisted, stable controls while watching, and version binding."
          ]
        },
        {
          "id": "debrief-and-counterfactual",
          "status": "satisfied",
          "evidence": [
            "Six event-bound objectives distinguish reconciliation, non-closure on a single marker or on vaccination, activation, the timing and fluid-ceiling boundary, bounded intent with consultant attendance, and accountable handoff. Refused shortcuts remain visible after later care, and neither survival nor source control is certified."
          ]
        },
        {
          "id": "source-provenance",
          "status": "satisfied",
          "evidence": [
            "3 source citation(s) are declared."
          ]
        },
        {
          "id": "scenario-specific-limitations",
          "status": "satisfied",
          "evidence": [
            "3 limitation record(s) are linked."
          ]
        },
        {
          "id": "reference-transcripts",
          "status": "satisfied",
          "evidence": [
            "meningococcal-sepsis-fixtures.ts binds exact-content expert, common-error, recovery, and no-action pathways for deterministic replay through the shared engine."
          ]
        },
        {
          "id": "inclusive-runtime-verification",
          "status": "missing",
          "evidence": [
            "Local checks do not complete exact-version assistive-technology, keyboard, phone, zoom, reduced-motion, offline, and performance validation."
          ]
        },
        {
          "id": "report-control-coverage",
          "status": "missing",
          "evidence": [
            "Shared report controls and local privacy tests do not establish full inclusive coverage or production Turnstile/D1 verification for this version."
          ]
        }
      ]
    },
    {
      "scenarioId": "obstructed-infected-kidney-decompression",
      "title": "Infected obstructed kidney: drainage is the treatment",
      "moduleId": "infectious-disease",
      "environment": "emergency-department",
      "estimatedMinutes": 8,
      "difficulty": "advanced",
      "prerequisites": [],
      "practiceRegions": [
        "US",
        "GB"
      ],
      "fidelityClass": "state_transition",
      "contentVersion": "0.1.0",
      "capabilityVersion": "0.1.0-alpha.48",
      "maturity": "preview",
      "complete": false,
      "requirements": [
        {
          "id": "identity-and-versions",
          "status": "satisfied",
          "evidence": [
            "Scenario obstructed-infected-kidney-decompression carries stable content version 0.1.0.",
            "Capability version 0.1.0-alpha.48 is bound by this audit."
          ]
        },
        {
          "id": "bounded-fictional-patient",
          "status": "satisfied",
          "evidence": [
            "The declarative scenario schema validates a bounded fictional patient profile."
          ]
        },
        {
          "id": "observable-objectives",
          "status": "satisfied",
          "evidence": [
            "6 objectives map to debrief rubric evidence."
          ]
        },
        {
          "id": "deterministic-seed-policy",
          "status": "satisfied",
          "evidence": [
            "obstructed-kidney-fixtures.ts binds seed 5203 and content 0.1.0 to expert, incomplete-care, recovery, and no-action contrasts. No infection, drainage, or kidney-recovery model is claimed."
          ]
        },
        {
          "id": "meaningful-progression",
          "status": "satisfied",
          "evidence": [
            "obstructed-kidney.ts separates a six-hour untreated deterioration on appropriate antimicrobials from a six-hour post-decompression assessment. The decompressed state improves observations and lactate while the C-reactive protein keeps rising, so marker direction cannot be used as the success signal. Unrequested laboratory and observation findings remain private."
          ]
        },
        {
          "id": "meaningful-actions-and-choices",
          "status": "satisfied",
          "evidence": [
            "Dose-free choices independently record obstruction recognition, urology and interventional-radiology activation, culture sampling, bounded decompression intent, deferral of definitive stone treatment, boundary review, and surveillance. Continuing antimicrobials alone, waiting for a marker trend, declaring one drainage modality correct, and treating the stone during active infection are refused."
          ]
        },
        {
          "id": "shared-capability-consequences",
          "status": "satisfied",
          "evidence": [
            "The scenario executes through the shared deterministic anesthesia engine rather than a display-only script."
          ]
        },
        {
          "id": "bounded-stop-condition",
          "status": "satisfied",
          "evidence": [